{
  "schema_version": "1.0.0",
  "artifact_id": "dflow_dev_fixture_public",
  "capture_run_id": "tests_fixtures",
  "matched_set_id": null,
  "provider": "dflow",
  "surface": "dev_quote",
  "endpoint_type": "developer",
  "endpoint_hostname": "dev-quote-api.dflow.net",
  "authentication_mode": "none",
  "captured_at_utc": "2026-07-29T12:34:22Z",
  "pair": "USDC/SOL",
  "input_mint": "EPjFWdd5AufqSSqeM2qN1xzybapC8G4wEGGkZwyTDt1v",
  "output_mint": "So11111111111111111111111111111111111111112",
  "raw_input_amount": "1000000000",
  "slippage_configuration": "50_bps",
  "raw_artifact_path": "tests/fixtures/dev_quote_usdc_sol_no_tx.json",
  "raw_artifact_sha256": "9102b5ffcee762d62aab442d5d4f06b380415b4747a62e152fd4b5dfaf7aaa9a",
  "sanitized_artifact_path": "tests/fixtures/dev_quote_usdc_sol_no_tx.json",
  "sanitization_status": "not_required",
  "transaction_presence": "absent",
  "signature": null,
  "source_notes": "Public test fixture only. Not for fingerprint promotion."
}
